{
  "$schema": "http://json-schema.org/schema#",
  "type": "object",
  "properties": {
    "damage_relations": {
      "type": "object",
      "properties": {
        "double_damage_from": {
          "type": "array",
          "items": {
            "type": "object",
            "properties": {
              "name": {
                "type": "string"
              },
              "url": {
                "type": "string"
              }
            },
            "required": [
              "name",
              "url"
            ]
          }
        },
        "double_damage_to": {
          "type": "array"
        },
        "half_damage_from": {
          "type": "array"
        },
        "half_damage_to": {
          "type": "array",
          "items": {
            "type": "object",
            "properties": {
              "name": {
                "type": "string"
              },
              "url": {
                "type": "string"
              }
            },
            "required": [
              "name",
              "url"
            ]
          }
        },
        "no_damage_from": {
          "type": "array",
          "items": {
            "type": "object",
            "properties": {
              "name": {
                "type": "string"
              },
              "url": {
                "type": "string"
              }
            },
            "required": [
              "name",
              "url"
            ]
          }
        },
        "no_damage_to": {
          "type": "array",
          "items": {
            "type": "object",
            "properties": {
              "name": {
                "type": "string"
              },
              "url": {
                "type": "string"
              }
            },
            "required": [
              "name",
              "url"
            ]
          }
        }
      },
      "required": [
        "double_damage_from",
        "double_damage_to",
        "half_damage_from",
        "half_damage_to",
        "no_damage_from",
        "no_damage_to"
      ]
    },
    "name": {
      "type": "string"
    },
    "id": {
      "type": "integer"
    },
    "pokemon": {
      "type": "array",
      "items": {
        "type": "object",
        "properties": {
          "name": {
            "type": "string"
          },
          "url": {
            "type": "string"
          },
          "slot": {
            "type": "integer"
          }
        },
        "required": [
          "name",
          "slot",
          "url"
        ]
      }
    }
  },
  "required": [
    "damage_relations",
    "id",
    "name",
    "pokemon"
  ]
}